,verse,citation count,verse texts,filter row
514,John 16:20,3,"['Vpravdě, vpravdě pravím vám: Vy budete kvíliti a plakati, ale svět se bude radovati; vy se budete rmoutiti, ale zármutek váš obrátí se v radost.']",low
515,Gen 9:1,4,"['Žehnaje pak Hospodin Noemovi a synům jeho pravil: Rosťte, množte se a naplňte zemi:']",low
516,Matt 15:27,1,"['A ona řekla: „Ovšem Pane, neboť i psíci jedí z drobtů, které padají se stolu pánů jejich.“']",low
517,Dan 5:25,6,"['A totoť jest písmo napsané: Mene, mene, tekel, ufarsin, totiž: Zčetl jsem, zčetl, zvážil a rozděluji.', 'A toto jest písmo, jež napsáno bylo: Mane, Thekel, Fares.']",low
518,John 3:21,3,"['Kdo však čini pravdu, jde ke světlu, aby skutkové jeho se zjevili, neboť v Bohu jsou vykonáni.', 'kdo pak činí pravdu, jde k světlu, aby byli zjeveni skutkové jeho, že v Bohu učiněni sou.']",low
519,John 3:20,3,"['Každý zajisté, kdož zle činí, nenávidí světla, a nejde k světlu, aby nebyli trestáni skutkové jeho.', 'Každý zajisté, kdo činí zlé, nenávidí světla a nejde ke světlu, aby nebyli usvědčeni skutkové jeho.']",low
520,Matt 11:22,1,['Avšak pravím vám: Tyru a Sidonu bude lehčeji v den soudný nežli vám.'],low
521,Matt 11:23,1,"['A ty, Kafarnaum, nebylo jsi vyvýšeno až do nebe? Do pekla budeš sraženo! Neboť, kdyby se v Sodomě byly udály mocné činy, které se udály v tobě, byla by obstála až podnes.']",low
522,Matt 11:24,1,['Avšak pravím vám: Zemi sodomské bude lehčeji v den soudný nežli tobě.“'],low
523,Isa 5:2,1,"['Kterouž ohradil, a kamení z ní vybral, a vysadil ji vinným kmenem výborným, a ustavěl věži u prostřed ní, také i pres udělal v ní, a očekával, aby nesla hrozny, ale vydala plané víno.']",low
524,Matt 5:22,5,"['Ale já-ť pravím vám, že každý, kdož se hněvá na bratra svého, hoden bude soudu. Kdož by pak řekl bratru svému rácha, hoden bude rady. A kdož by řekl blázne, hoden bude pekelného ohně']",low
525,Gen 4:6,3,['I řekl Pán k němu: Proč si se rozhněval? a proč opadla tvář tvá?'],low
526,Luke 22:49,1,"['Ti pak, kteří byli při něm, uzřevše, co nastává, řekli jemu: „Pane, máme bíti mečem?“']",low
527,Mark 14:7,3,"['nebo chudé máte vždycky s sebou; a když budete chtíti, můžete jim dobře činiti: mne pak na vždycky máte.']",low
528,Dan 9:24,2,"['Sedmdesát týdnů je stanoveno tvému národu a svatému městu tvému, aby zamezena byla neřest, aby konec vzal hřích, a zahlazena byla nepravost; aby přivedena byla věčná spravedlnost, aby se splnilo vidění i proroctví, aby pomazán byl svatý svatých.']",low
529,Matt 2:6,4,"['»A ty, Betléme v zemi Judské, nejsi nikterak poslední mezi judskými vůdčími městy, neboť z tebe vzejde vůdce, který bude pastýřem mého izraelského lidu.«“', 'A ty, Betleme, území judské, nikoli nejsi nejmenší mezi knížecími městy judskými: neboť z tebe vyjde vévoda, který bude spravovat lid můj israelský.“', 'A ty Betléme země Júdská, nikoli nejsi nejmenší mezi Knížaty Júdskými: neboť z tebe vyjde Vývoda, kterýž by zpravoval lid můj Izraelský.']",low
530,Matt 12:7,7,"['Než kdybyste věděli, co jest to: Milosrdenství chci a ne oběti, nepotupovali byste nevinných.', 'Kdybyste věděli, co znamená slovo: »Milosrdenství chci, ne oběť«, neodsoudili byste nevinných.']",low
531,Eph 5:27,3,"['Aby ji sobě postavil slavnou církev, nemající poškvrny, ani vrásky, neb cokoli takového, ale aby byla svatá, a bez úhony.', 'aby sám sobě představil církev jako slavnou, jako takovou, která by neměla poskvrny ani vrásky neb něco podobného, nýbrž aby byla svatá a bezúhonná.']",low
532,Sir 24:17,1,"['Jako cedr vyvýšena sem na Libánu, a jako cypřiš na hoře Syon:']",low
533,Ezek 24:25,1,"['A ty, synu člověkův, aj, v ten den, kdy jim vezmu sílu jejich, radost z důstojnosti jejich, rozkoš očí jejich, to, na čem lpí jejich duše, syny a dcery jejich:']",low
534,Heb 12:24,1,"['A k prostředníku Nového Zákona Ježíšovi, a ku pokropení krví, lépe mluvící než Abelova.']",low
535,Matt 1:20,4,"['Když pak on o tom přemyšloval, aj, anděl Páně ve snách ukázal se jemu, řka: Jozefe synu Davidův, neboj se přijíti Marie manželky své; nebo což v ní jest počato, z Ducha svatého jest.']",low
536,1Pet 2:19,1,"['To zajisté jest milost, jestli někdo ze svědomitosti k Bohu snáší útrapy, trpě nespravedlivě.']",low
537,1Pet 2:18,1,"['Služebníci, poddáni buďte ve vší bázni pánům, nejen dobrým a mírným, nýbrž i zlým.']",low
538,1Pet 2:20,1,"['Nebo jaká jest sláva, jestliže hřešíce, a pohlavkováni souce snášíte? Ale jestliže dobře činíce, trpělivě snášíte, tať jest milost u Boha.']",low
539,1John 4:16,3,"['A myť jsme poznali, a uvěřili o lásce, kterouž Bůh má k nám. Bůh láska jest, a kdož v lásce přebývá, v Bohu přebývá, a Bůh v něm.']",low
540,Phil 3:1,2,"['Dale pak bratří moji, radújte se v Pánu. Jednostejné věci vám psáti, mně se zajisté nestejště, vám pak potřebné (jest.)']",low
541,1Kgs 19:11,1,"['I řekl mu: „Vyjdiž a stůj na hoře před Hospodinem; Hospodin (právě) jde tudy, a vítr veliký a silný, podvracející hory a rozrážející skály před Hospodinem; ale není v tom větru Hospodin. A po větru zemětřesení; ale není v tom zemětřesení Hospodin.']",low
542,Isa 12:6,2,"['Prokřikni a zpívej, obyvatelkyně Sionská, nebo veliký jest u prostřed tebe Svatý Izraelský.']",low
543,Phil 2:3,1,"['nic podle sobectví, ani podle ctižádosti, nýbrž v pokoře pokládajíce jeden druhého za lepšího než sebe,']",low
544,Gen 15:8,2,"['Ale on řekl: Pane Bože, odkud věděti mohu, že jí vládnouti budu?']",low
545,Phil 4:5,1,['Vlídnost vaše budiž známa všem lidem; Pán blízko jest.'],low
546,Matt 3:17,3,"['A hle, hlas s nebe řkoucí: „Tento jest Syn můj milý, v němž se mi zalíbilo.“']",low
547,Matt 17:6,2,"['To uslyšavše učedlníci, padli na tváři své a báli se velmi.']",low
548,Acts 19:2,2,"['a otázal se jich: „Zdalipak jste přijali Ducha svatého, když jste uvěřili?“ Oni mu odpověděli: „Ne, ani jsme neslyšeli, že by byl Duch svatý.“']",low
549,Rom 8:31,3,"['Což tedy díme k těmto věcem? Jestli Bůh s námi, kdo proti nám?']",low
550,1Pet 5:8,1,"['Střízliví buďte, bděte; nebo protivník váš ďábel jako lev řvoucí obchází, hledaje, koho by sežral.']",low
551,Luke 22:41,6,"['Sám se od nich vzdálil, asi co by kamenem dohodil, klekl a modlil se: ']",low
552,Job 19:21,9,"['Slitújte se nade mnou, slitújte se nade mnou, aspoň vy přátelé moji, nebo ruka Páně dotkla se mne.', 'Cit se mnou mějte přec, cit mějte, vy moji přátelé, neboť ruka Páně dotkla se mne.']",low
553,Matt 5:8,11,"['Blahoslavení čistého srdce, nebo oni Boha viděti budou.', 'Blahoslavení čistého srdce, neboť oni Boha viděti budou.']",low
554,Luke 10:7,6,"['A v témž domu ostaňte, jedouce a pijíce, což u nich jest, nebo hoden jest dělník mzdy své. Nechoďtež z domu do domu.', 'V tom domě pak zůstávejte jedouce a pijíce, co mají; neboť hoden jest dělník mzdy své. Nepřecházejte z domu do domu.']",low
555,1Tim 5:16,1,"['Protož má-liť kdo věřící neb která věřící vdovy, opatrujž je, a nebuď obtěžována církev, aby těm, kteréž právě vdovy jsou, postačilo.']",low
556,Luke 14:11,7,"['neboť každý, kdo se povyšuje, bude ponížen, a kdo se ponižuje, bude povýšen.', 'Nebo každý, kdož se povyšuje, bude ponížen; a kdož se ponižuje, bude povýšen.']",low
557,Lev 26:1,1,"['Nedělejte sobě modl, ani obrazu rytého, aneb sloupu nevyzdvihnete sobě, ani kamene malovaného v zemi vaší nestavějte, abyste se jemu klaněli; nebo já jsem Hospodin Bůh váš.']",low
558,Luke 24:29,11,"['ale oni přinutili ho řkouce: „Zůstaň s námi, neboť se připozdívá, a den se již nachýlil.“ I vešel s nimi.']",low
559,Rom 11:36,2,"['Nebo z něho, a skrze něho, a v něm jsou všecky věci, jemuž sláva na věky. Amen.']",low
560,Luke 12:31,2,"['Ale hledejte království Božího, a toto všecko bude vám přidáno.']",low
561,Judg 16:31,1,"['Sstoupivše pak bratří jeho, i všecko příbuzenství, vzali tělo jeho, a pochovali mezi Saraa a Esthaol v hrobě otce jeho Manue: i soudil Izraele dvadceti let.']",low
562,2Kgs 5:12,1,"['Zdali nejsou lepší Abana a Farfar, řeky Damašské, nad všecky vody Izraelské? Zdaliž bych se nemohl v nich zmýti, abych čist byl? A obrátiv se, jel s hněvem.']",low
563,Matt 25:41,4,"['Potom řekne i těm, kteří budou na levici: ,Odejděte ode mne, zlořečení, do ohně věčného, který jest připraven ďáblu a andělům jeho.', 'Potom i těm na levici dí: Jděte ode mne zlořečení do ohně věčného, kterýž jest připraven ďáblu i andělům jeho.']",low
564,Mark 14:65,1,"['A počali někteří naň plvati, a tvář jeho zakrývati, a jej pohlavkovati, a říkati jemu: Prorokůj: a služebníci v líce ho bili.']",low
565,John 20:2,2,"['I běžela a přišla k Šimonu Petrovi a k jinému učeníku, kterého miloval Ježíš a řekla jim: „Vzali Pána z hrobu, a nevíme, kam ho položili“.', 'Protož běžela, a přišla k Šimonovi Petrovi, a k jinému učedlníku, kteréhož miloval Ježíš, i dí jim: Vzali Pána z hrobu, a nevíme, kde jej položili.']",low
566,Matt 28:2,2,"['A hle, zemětřesení stalo se veliké; neboť anděl Páně sestoupil s nebe a přistoupiv odvalil kámen a posadil se na něm.', 'Hle, nastalo veliké zemětřesení; neboť anděl Páně sestoupil z nebe, přistoupil, odvalil kámen a posadil se na něj. ']",low
567,John 5:28,2,"['Nedivte se tomu, neboť přichází hodina, ve které všichni, kteří v hrobech jsou, uslyší hlas jeho,', 'Nedivtež se tomu; neboť přijde hodina, v kterouž všickni, kteříž v hrobích jsou, uslyší hlas jeho.']",low
568,Mark 9:9,7,"['I podrželi slovo to u sebe, ač se ptali, co by to znamenalo: „Až vstane z mrtvých.“']",low
569,2Tim 4:7,17,"['Dobrý boj sem bojoval, běh sem dokonal, víru sem zachoval.', 'Boj výborný bojoval jsem, běh jsem dokonal, víru jsem zachoval.', 'Dobrý boj jsem bojoval, běh jsem dokonal, víru jsem zachoval;']",low
570,1Cor 15:17,8,"['Nevstal-liť Kristus z mrtvých, marná jest víra vaše, nebo ještě jste v hříších svých.']",low
571,Sir 51:24,2,"['Umínil jsem si [totiž], že budu ji činit; horlil jsem o dobro, a nebyl jsem zahanben.']",low
572,Deut 31:20,6,"['Nebo uvedu jej do země, kterouž jsem s přísahou zaslíbil otcům jeho, oplývající mlékem a strdí, kdežto bude jísti a nasytí se a ztuční. Tehdy obrátí se k bohům cizím a sloužiti bude jim, i popudí mne a zruší smlouvu mou.']",low
573,Mark 10:25,2,"['Snáze jest velbloudu projíti uchem jehelním, než boháči vejíti do království Božího.“']",low
574,Matt 16:19,4,"['A tobě dám klíče království nebeského. A což bys koli svázal na zemi, budeť svázáno i na nebi; a což bys koli rozvázal na zemi, budeť rozvázáno i na nebi.', 'A tobě dám klíče Království Nebeského: a cožkoli svážeš na zemi, bude-ť svázáno i na nebi: a cožkoli rozvážeš na zemi, bude-ť rozvázáno i na nebi.']",low
575,Matt 18:18,2,"['Amen pravím vám: Cožkoli svížete na zemi, budeť svázáno i na nebi; a cožkoli rozvížete na zemi, budeť rozvázáno i na nebi.', 'Amen pravím vám, cožkoli svážete na zemi, bude-ť svázáno i na Nebi: a cožkoli rozvážete na zemi, bude-ť rozvázáno i na Nebi.']",low
576,John 21:15,1,"['Když tedy poobědvali, dí Ježíš Šimonovi Petrovi: Šimone Janů, miluješ-li mne více nežli tito? Dí jemu: Ovšem Pane, ty víš, žeť miluji tebe. Dí jemu: Pasiž beránky mé.']",low
577,Luke 16:3,3,"['I dí vládař sám v sobě: Co učiním? Teď pán můj odjímá ode mne vládařství. Kopati nemohu, žebrati se stydím.']",low
578,Luke 10:3,1,"['Jdětež. Aj, já posílám vás jako berany mezi vlky.']",low
579,Matt 15:14,1,"['Nechte jich; slepí jsou to vůdcové slepých; vede-li však slepý slepého, padnou oba do jámy.“']",low
580,Matt 7:15,8,"['Pilně se pak varujte falešných proroků, kteříž přicházejí k vám v rouše ovčím, ale vnitř jsou vlci hltaví.', 'Pilně se varújte falešných Proroků, kteříž přicházejí k vám v rouše ovčím, vnitř pak jsou vlci hltaví:', 'Mějte se na pozoru před nepravými proroky, kteří přicházejí k vám v rouše ovčím, uvnitř však jsou vlci draví.']",low
581,Exod 2:4,2,"['A postavila sestru jeho zdaleka, aby zvěděla, co se s ním díti bude.']",low
582,John 3:19,3,"['Totoť pak jest ten soud, že světlo přišlo na svět, ale milovali lidé více tmu nežli světlo; nebo skutkové jejich byli zlí.', 'To pak jest soud, že světlo přišlo na svět, a lidé milovali více tmu nežli světlo; neboť skutkové jejich byli zlí.']",low
583,Job 19:25,4,"['Ačkoli já vím, že vykupitel můj živ jest, a že v den nejposlednější nad prachem se postaví.']",low
584,Deut 7:6,1,"['Nebo jsi národ zasvěcený Hospodinu, Bohu svému; tebe vyvolil Hospodin, Bůh tvůj, ze všech národů, kteří jsou na zemi, bys byl zvláštním způsobem národem jeho.']",low
585,2John 1:4,1,"['Velice jsem se zaradoval, že jsem shledal mezi tvými dětmi takové, které žijí v pravdě, jak jsme přijali příkaz od Otce. ']",low
586,Rom 8:19,1,['Vždyť i tvorstvo očekává s toužebnosti zjevení synů Božích. '],low
587,Rev 22:13,3,"['Jáť jsem Alfa i Oméga, počátek i konec, první i poslední.']",low
588,Matt 24:28,1,"['Kdežkoli bude tělo, tu-ť se shromáždí i orlové.']",low
589,John 8:58,4,"['Řekl jim Ježíš: Amen, amen pravím vám, prvé nežli Abraham byl, já jsem.', 'Ježíš řekl jim: „Vpravdě, vpravdě pravím vám: Prve než Abraham byl, jsem já.“']",low
590,Prov 14:34,3,"['Spravedlnost zvyšuje národ, ale hřích jest ku pohanění národům.']",low
591,John 10:30,15,['Já a Otec jedno jíme.'],low
592,1Pet 2:24,1,"['kterýžto hříchy naše na svém těle sám vnesl na dřevo: abychom hříchům zemrouce, spravedlnosti živi byli: jehož zsinalostí uzdraveni ste.']",low
593,John 7:34,1,"['Budete mě hledati a nenaleznete, a kde jsem já, (tam) vy nemůžete přijíti.“']",low
594,Matt 25:35,5,"['neboť lačněl jsem, a dali jste mi jísti, žíznil jsem, a dali jste mi píti; hostem jsem byl, a přijali jste mě;', '+ nebo sem lačněl, a dali ste mi jísti: žíznil sem, a dali ste mi píti: hostem sem byl, a přijali ste mne:', 'Nebo jsem lačněl, a dali jste mi jísti; žíznil jsem, a dali jste mi píti; hostem jsem byl, a přijímali jste mne;']",low
595,Exod 40:19,1,"['Když vnesl archu do stánku, zavěsil před ni oponu, aby vyplnil příkaz Hospodinův.']",low
596,Luke 14:12,1,"['Pravil však i k tomu, který ho pozval: „Strojíš-li oběd neb večeři, nezvi přátel svých, ani bratrů svých, ani příbuzných svých, ani sousedů bohatých, aby snad také oni nepozvali zase tebe a nedostalo se ti odplaty.']",low
597,Luke 14:13,2,"['Ale když strojíš hostinu, povolávej chudých, zmrzačelých, kulhavých a slepých,']",low
598,Luke 14:15,1,"['Uslyšev to jeden ze spolustolujícich, řekl jemu: „Blažen, kdo bude jísti chléb v království Božím.“']",low
599,Luke 14:16,1,"['On pak řekl jemu: Člověk nějaký učinil večeři velikou, a pozval mnohých.']",low
600,Matt 23:13,3,"['Ale běda vám, zákonníci a farizeové pokrytci, že zavíráte království nebeské před lidmi; nebo sami tam nevcházíte, a těm, kteříž by vjíti chtěli, vcházeti nedopouštíte.']",low
601,Matt 23:33,1,"['Hadové, plémě zmijí, kterak utečete před soudem pekelným?']",low
602,Matt 9:4,3,"['Ale Ježíš, znaje smýšlení jejich, řekl: „Proč myslíte zlé věci v srdcích svých?']",low
603,John 15:27,1,"['avšak i vy budete svědčiti, neboť jste se mnou od počátku“.']",low
604,Matt 26:61,1,"['a řekli: Tento řekl: Mohu zbořiti Chrám Boží, a ve třech dnech zase jej vystavěti.']",low
605,Matt 19:23,1,['Ježíš pak řekl učeníkům svým: „Vpravdě pravím vám: Boháč vejde těžko do království nebeského.'],low
606,Matt 20:19,1,"['vydají jej pohanům, aby ho potupili, bičovali jej a ukřižovali; ale třetího dne bude vzkříšen.“']",low
607,Mark 16:6,4,"['On pak řekl jim: „Nebojte se; hledáte Ježíše Nazaretského, ukřižovaného; vstalí jest; není ho tuto; hle, místo, kdež jej položili.']",low
608,John 11:24,3,"['Dí jemu Marta: „Vím, že vstane při vzkříšení v den poslední.“']",low
609,Mark 15:18,2,"['a počali ho pozdravovati: „Zdráv buď, králi židovský“,']",low
610,Luke 10:25,1,"['A aj jeden v Zákoně učený vstal, pokoušeje ho, a řka: Mistře, co čině, život věčný obdržím?']",low
611,Luke 10:29,3,"['Ale on chtěje se ospravedlniti, řekl k Ježíšovi: „A kdo jest můj bližní?“', 'On však se chtěl ospravedlniti a řekl Ježíšovi: „A kdo je můj bližní?“']",low
612,John 1:4,1,"['V něm byl život, a život byl světlo lidí.']",low
613,John 1:5,2,"['a Světlo ve tmě svítí, a tma ho nepojala.']",low
614,Matt 28:5,1,"['I promluvil anděl a řekl ženám: „Nebojte se vy! Neboť vím, že hledáte Ježíše, který byl ukřižován.']",low
615,2Tim 4:2,2,"['hlásej slovo, naléhej včas i nevčas, usvědčuj, přimlouvej, kárej, (a to) se vší trpělivostí a moudrostí učitelskou.', 'kaž slovo, naléhej, ať je to vhod či nevhod, přesvědčuj, hroz, napomínej, s veškerou shovívavostí a s učením. ']",low
616,Ps 53:4,1,"['Bože, vyslyš modlitbu mou, popřej sluchu slovům úst mých.']",low
617,Mark 14:27,5,"['I řekl jim Ježíš: „Všichni pohoršíte se nade mnou této noci; neboť psáno jest: ,Bíti budu pastýře a rozprchnou se ovce.‘', 'Ježíš jim dí: „Všichni se odvrátíte, neboť je psáno: „Budu bíti pastýře, a ovce se rozprchnou“. ']",low
618,Luke 16:13,9,"['Nižádný služebník nemůž dvěma pánům sloužiti: nebť zajisté jednoho nenáviděti bude, a druhého milovati: aneb jednoho přidržeti se bude, a druhým pohrdne. nemůžte Bohu sloužiti a mamoně.', 'Žádný služebník nemůže dvěma pánům sloužiti, neboť buď jednoho bude nenáviděti a druhého milovati, aneb jednoho se přidrží a druhým pohrdne. Nemůžete Bohu sloužiti a mamoně.“', '„Žádný čeledín nemůže sloužiti dvěma pánům; buď totiž jednoho bude nenáviděti a druhého milovati, nebo jednomu dá přednost a druhým pohrdne. Nemůžete sloužiti Bohu a mamonu.“']",low
619,2Sam 23:21,1,"['ten zabil také kteréhos Egypťana, muže, který stál za podívanou; ten měl v rukou kopí, i vyšel na něho s holí, mocí vytrhl Egypťanovi kopí z ruky a zabil ho jeho (vlastním) kopím.']",low
620,Rev 2:17,1,"['Kdo má ucho, slyš, co Duch praví Církvím: Tomu kterýž svítězí, dám mannu skrytou, a dám jemu kamének bílý: a na kaménku jméno nové napsané, kteréhož žádný neví, než ten, kdož (je) přijímá.']",low
621,Mark 6:18,1,['Nebo pravil Jan Heródesovi: Neslušíť tobě míti manželky bratra svého.'],low
622,Judg 6:20,1,"['Anděl Hospodinův mu řekl: „Vezmi maso a nekvašené chleby, polož (to) na onu skálu a vylej na to polévku."" Když tak učinil,']",low
623,Mark 8:2,8,"['„Lítost mám nad zástupem, neboť již tři dni trvají se mnou a nemají, co by jedli;']",low
624,Eccl 1:7,1,"['Všecky řeky vcházejí do moře, a moře nepřeplňuje se; na místo, odkud řeky vyšly, vracejí se, aby zas tekly.']",low
625,Acts 2:22,1,"['Muží Izraelští, slyšte slova tato: Ježíše Nazarétského, muže zchváleného od Boha mezi vámi, mocmi, a zázraky, a znameními, kteréž činil Bůh skrze něho u prostřed vás, jakož i vy víte:']",low
626,Sir 3:27,1,"['Srdce tvrdé zle se míti bude na konec, neboť kdo miluje nebezpečí, zahyne v něm.']",low
627,2Cor 12:4,1,"['vtržen do ráje a uslyšel slova nevypravitelná, kterých nepřísluší člověku mluviti.']",low
628,2Cor 12:2,1,"['Znám člověka v Kristu, jenž před čtrnácti roky byl vtržen až do třetího nebe, zdali v těle, nevím, aneb-li kromě, těla, nevím; Bůh to ví.']",low
629,Luke 8:8,6,"['A jiné padlo v zemi dobrou a vzešedši vydalo užitek stonásobný.“ To pověděv zvolal: „Kdo má uši k slyšení, slyš.“']",low
630,John 14:26,5,"['Utěšitel pak Duch Svatý, kteréhož pošle Otec ve jménu mém, tenť vás naučí všem věcem, a připomene vám všecky věci, kteréžkoli budu mluviti vám.', 'Utěšitel pak, ten Duch svatý, kteréhož pošle Otec ve jménu mém, onť vás naučí všemu, a připomeneť vám všecko, což jsem koli mluvil vám.', 'Utěšitel pak, Duch svatý, kteréhož Otec pošle ve jménu mém, ten vás naučí všem věcem a připomene vám všecko, co jsem mluvil vám.']",low
631,1Cor 3:16,5,"['Nevíte, že jste chrámem Božím, a že Duch Boží přebývá ve vás?', 'Zdaliž nevíte, že chrám Boží jste, a Duch Boží v vás přebývá?', 'Nevíte-li, že Chrám Boží jste, a Duch Boží přebývá v vás?']",low
632,Gen 42:9,1,"['I rozpomenuv se na sny, kteréž byl někdy viděl, řekl k nim: Špehéři jste: abyste shlédli mdlejší místa země, přišli ste.']",low
633,Luke 9:62,3,"['Ježíš mu odpověděl: „Nikdo, kdo vloží ruku na pluh a ohlíží se zpět, není způsobilý pro království Boží.“', 'Řekl jemu Ježíš: Žádný, kdož vztáhna ruku svou k pluhu, ohlídal by se nazpět, není způsobný k království Božímu.']",low
634,Rev 3:10,1,"['Poněvadž si zachoval slovo trpělivosti mé, i já tebe zachovám od hodiny pokušení, kteréž přijde na všecken svět k zkušení přebývajících na zemi.']",low
635,Rev 3:8,1,"['Vím skutky tvé. Hle dal sem před tebou dvéře otevřené, kterých žádný nemůže zavříti: nebo máš malou moc, a zachoval si slovo mé, a nezapřel si jména mého.']",low
636,Rev 3:11,1,"['Hle přicházím brzo: drž co máš, aby žádný nevzal koruny tvé.']",low
637,Dan 10:6,1,"['a tělo jeho jako chrysolit. Tvář jeho zářila jako blesk, oči jeho jako hořící pochodně, ramena jeho a tělo dolů až k nohám jako rozpálená měď, a zvuk řeči jeho jako hukot množství.']",low
638,Num 16:29,1,"['Jestliže tak jako jiní lidé mrou, zemrou i tito, a navštívením obecným všechněm lidem jestliže navštíveni budou, neposlal mne Hospodin.']",low
639,Ps 147:1,1,"['Chval, Jerusaleme, Hospodina, chval svého Boha, Sione,']",low
640,Heb 13:8,1,['Ježíš Kristus včera i dnes: on i na věky.I'],low
641,John 5:33,4,"['Vy jste vyslali poselství k Janovi, a on vydal svědectví pravdě.', 'Vy jste byli poslali k Janovi, a on svědectví vydal pravdě.']",low
642,John 18:37,9,"['Tedy řekl jemu Pilát: Tedy Král jsi ty? Odpověděl Ježíš: Ty pravíš, že Král jsem já. Já jsem se k tomu narodil, a proto sem na svět přišel, abych svědectví vydal pravdě: každý, kdož jest z pravdy, slyší hlas můj.', 'I řekl jemu Pilát: Tedy král jsi ty? Odpověděl Ježíš: Ty pravíš, že já král jsem. Jáť jsem se k tomu narodil, a proto jsem na svět přišel, abych svědectví vydal pravdě. Každý, kdož jest z pravdy, slyší hlas můj.', 'I řekl mu Pilát: „Tedy králem jsi ty?“ Ježíš odpověděl: „Ano, já jsem král. Já jsem se k tomu narodil a proto jsem přišel na svět, abych vydal svědectví pravdě. Každý, kdo jest z pravdy, slyší hlas můj.“']",low
643,Matt 9:5,4,"['Co jest snáze říci: „Odpouštějí se tobě hříchové tvoji,“ aneb říci: „Vstaň a choď?“']",low
644,Rev 14:10,1,"['i ten-ť bude píti víno hněvu Božího, které jest smíšeno s čistým vínem v kalichu hněvu jeho, a trápen bude ohněm a sirou, před obličejem Anjelů svatých, a před obličejem Beránka:']",low
645,Ezek 16:19,1,"['Chléb můj, který jsem tobě dal, běl, olej a med, jimiž jsem tě krmil, kladlas před obličej jejich k líbezné vůni. Stalo se, praví Hospodin Bůh.']",low
646,Luke 12:8,2,"['Pravím pak vám: Každého, kdo mě vyzná před lidmi, i Syn člověka vyzná před anděly Božími.']",low
647,Acts 5:39,4,"['je-li však z Boha, nebudete moci je zrušiti; - abyste snad nebyli shledáni jako odbojní Bohu.“ I poslechli ho.']",low
648,Matt 16:4,1,"['Způsob tedy nebe rozsouditi umíte: znamení pak časů nemůžete věděti? Národ zlý a cizoložný znamení hledá: a znamení jemu nebude dáno, než znamení Jonáše Proroka. a opustiv je, odšel.']",low
649,Mark 1:7,3,"['A kázal, řka: Jde za mnou silnější nežli já, kterémuž nejsem hoden, sehna se, rozvázati řeménka u obuvi jeho.']",low
650,Gen 13:14,1,"['I řekl Hospodin k Abramovi, když se byl Lot od něho odloučil: Pozvedni očí svých a pohled s místa, na němž nyní jsi, na sever, na jih, na východ a na západ.']",low
651,Mark 10:31,4,['Mnozí pak první budou posledními a poslední prvními.“'],low
652,Matt 19:30,4,['Mnozí pak první budou posledními a poslední prvními.“'],low
653,Ps 126:1,1,"['Stupňová píseň Šalomounova. Nestaví-li Hospodin domu, marně se lopotí, kteří jej stavějí. Neostříhá-li Hospodin města, nadarmo bdí, kdo je hlídá.']",low
654,2Sam 5:4,2,"['Ve třiceti letech byl David, když počal kralovati a kraloval čtyřicet let.']",low
655,Rom 16:24,6,"['Milost Pána našeho, Ježíše Krista, budiž se všemi vámi. Amen.']",low
656,Matt 10:36,2,"['a nepřátelé člověka, domácí jeho.', 'a nepřátelé člověka jsou domácí jeho.']",low
657,Gen 47:8,1,['Tedy řekl Farao k Jákobovi: Kolik jest let života tvého?'],low
