,verse,citation count,verse texts,filter row
1259,1Cor 5:8,4,"['Proto slavme hody nikoli s kvasem starým, ani s kvasem špatnosti a nešlechetnosti, nýbrž s přesnicemi upřímnosti a pravdy.', 'A protož hodujmež ne v kvasu starém, ani v kvasu zlosti a nešlechetnosti, ale v přesnicích upřímnosti a pravdy.']",low
1260,Rev 18:2,1,"['I zkřikl silně hlasem velikým, řka: Padl, padl Babylon ten veliký, a učiněn jest příbytkem ďáblů, a stráží každého ducha nečistého, a stráží všelikého ptactva nečistého a ohyzdného.']",low
1261,Prov 3:30,1,"['Nevaď se s člověkem bez příčiny, jestližeť neučinil zlého.']",low
1262,Gen 46:27,3,"['Synové Josefovi, kteří se mu narodili v Egypte, byly dvě duše. Všech duší domu Jakobova, které přišly do Egypta, bylo sedmdesát.']",low
1263,1Cor 9:14,1,"['Tak i Pán nařídil těm, kteříž evangelium zvěstují, aby z evangelium živi byli.']",low
1264,Luke 4:35,1,"['I přikázal mu Ježíš řka: „Umlkni a vyjdi od něho.“ A duch zlý vrhnuv jej doprostřed, vyšel od něho nic mu neuškodiv.']",low
1265,Luke 8:29,1,"['Přikazoval totiž duchu nečistému, aby vyšel od toho člověka. Neboť již po mnoho časů jej uchvacoval; i býval spoután řetězy a okovy a hlídán, ale on přetrhávaje pouta, býval puzen od ducha zlého na pouště.']",low
1266,Luke 8:27,1,"['A když vystoupil na zemi, potkal se s ním jeden muž z města, který měl ducha zlého již po mnoho časů, a neodíval se rouchem ani nezůstával v domě, nýbrž v hrobech.']",low
1267,Luke 8:30,1,"['I otázal se ho Ježíš řka: „Jak se jmenuješ?“ On pak řekl: „Pluk“, neboť mnoho duchů zlých vešlo do něho.']",low
1268,Luke 8:33,1,"['Vyšedše tedy duchové zlí od toho člověka, vešli do vepřů a tu hnalo se stádo srázem do jezera a utonulo.']",low
1269,Luke 8:37,1,"['I prosilo ho veškeré množství krajiny gerasenské, aby odešel od nich, neboť byli pojati bázní velikou. On tedy vstoupiv na loď, navrátil se.']",low
1270,Luke 9:61,1,"['Ještě jiný mu řekl: „Budu tě následovati, pane, jen mi napřed dovol, abych se rozloučil doma s rodinou.“']",low
1271,Matt 8:21,1,"['Jiný pak z učeníků jeho řekl jemu: „Pane, dovol mi prve odejíti a pochovati otce mého.“']",low
1272,Matt 19:21,2,"['Řekl mu Ježíš: „Chceš-li dokonalý býti, jdi, prodej co máš a dej chudým, a budeš míti poklad v nebi; a pojď a následuj mne.“', 'Ježíš mu řekl: „Chceš-li býti dokonalý, jdi, prodej svůj majetek, dej chudým, a budeš míti poklad v nebi; pak přijď a následuj mne!“']",low
1273,Matt 19:22,2,"['Uslyšev mládenec slova ta, odešel smuten, neboť měl mnoho statků.']",low
1274,Luke 19:40,2,"['Ale on řekl jim: „Pravím vám: Budou-li tito mlčeti, kamení bude volati.“', 'Odpověděl: „Pravím vám: Budou-li oni mlčeti, bude křičeti kamení.“']",low
1275,John 3:27,1,"['Odpověděl Jan a řekl: Nemůžť člověk vzíti ničeho, leč by jemu dáno bylo s nebe.']",low
1276,Luke 1:37,3,['Bohu není nic nemožného.“ '],low
1277,Luke 11:22,1,"['Když však silnější než on přijda, přemůže ho, odejme veškerou jeho zbroj, na níž spoléhal, a rozdělí kořist jeho.']",low
1278,Matt 12:45,1,"['Tu jde a vezme s sebou sedm jiných duchů horších, nežli jest sám, a vejdouce přebývají tam. I stávají se poslední věci člověka toho horší, než byly první. Tak bude i tomuto pokolení špatnému.“']",low
1279,John 19:7,1,"['Židé mu odpověděli: „My máme zákon, a podle zákona má umříti, neboť se činil Synem Božím.“']",low
1280,Matt 15:24,1,['On pak odpověděl: „Nejsem poslán leč k zahynulým ovcím domu israelského.“'],low
1281,Luke 21:10,1,"['Tehdy pravil jim: Povstaneť národ proti národu, a království proti království.']",low
1282,Matt 7:12,3,"['Všecko tedy, cokoli chcete, aby vám lidé činili, i vy čiňte jim. To-ť zajisté jest Zákon i Proroci.', 'Všecko tedy, co chcete, aby vám lidé činili, i vy tak čiňte jim; neboť to jest zákon i proroci.', 'A protož všecko, jakž byste chtěli, aby vám lidé činili, tak i vy čiňte jim; toť zajisté jest zákon i proroci.']",low
1283,Zech 4:1,1,"['Potom navrátil se anděl, kterýž mluvil se mnou, a zbudil mne jako muže, kterýž zbuzen bývá ze sna svého.']",low
1284,Luke 15:31,1,"['On však řekl jemu: ,Synu můj, ty jsi vždycky se mnou, a všecky věci mé jsou tvoje;']",low
1285,Luke 21:37,1,"['I býval ve dne v chrámě, uče, ale v noci vycházeje, přebýval na hoře, kteráž slove Olivetská.']",low
1286,Luke 19:31,1,"['A otáže-li se vás kdo: ,Proč je odvazujete?‘ takto mu řekněte: ,Pán ho potřebuje.‘“']",low
1287,Luke 19:33,1,"['A když odvazovali to oslátko, řekli páni jeho k nim: Proč odvazujete oslátko?']",low
1288,Luke 19:34,1,['Oni pak řekli: „Pán ho potřebuje.“'],low
1289,Song 4:12,1,"['Zahrada zamčená jsi sestro má, nevěsto; v zahradě zamčené pramen na pečeť.']",low
1290,2Cor 9:6,2,"['Ale totoť pravím: Kdo skoupě rozsívá, skoupě i žíti bude; a kdož rozsívá ochotně, ochotně i žíti bude.']",low
1291,Acts 16:30,1,"['a vyved je ven řekl: „Pánové, co mám činiti, abych byl spasen?“']",low
1292,Luke 14:21,1,"['A služebník vrátiv se, zvěstoval to pánu svému. Tu rozhněval se hospodář a řekl svému služebníku: ,Vyjdi rychle na náměstí a ulice města, a uveď sem chudé, zmrzačelé a slepé i kulhavé.‘']",low
1293,Luke 3:3,1,"['I chodil po vší okolní krajině Jordánské, káže křest pokání na odpuštění hříchů,']",low
1294,2Thess 3:10,2,"['Vždyť i když jsme byli u vás, přikazovali jsme vám toto: Nechce-li kdo pracovati, ať nejí.']",low
1295,2Thess 3:12,1,"['Takovým přikazujeme a napomínáme v Pánu Ježíši Kristu, aby pokojně pracujíce, jedli chléb svůj.']",low
1296,2Sam 10:5,1,"['To když oznámili Davidovi, poslal proti nim, (nebo muži ti zohaveni byli velice), a řekl jim král: Pobuďte v Jerichu, dokudž neobrostou brady vaše, potom se navrátíte.']",low
1297,Isa 60:6,1,"['Záplava velbloudů tě zatopí, dromedáři z Madjanu, z Efy; všichni také ze Saby přijdou, zlato, jakož i kadidlo přinesou a slávu Páně zvěstovat budou.']",low
1298,Gen 45:26,1,"['A zvěstovali jemu, řkouce: Jozef syn tvůj živ jest: a on panuje ve vší zemi Egyptské. Což uslyšev Jákob, jako z těžkého sna procítiv, však nevěřil jim.']",low
1299,Acts 5:41,1,"['I šli z velerady s radostí nad tím, že byli hodni učiněni trpěti pohanu pro jméno Ježíšovo,']",low
1300,Rev 21:3,2,"['I slyšel sem hlas veliký z trůnu, řkoucí: Hle stánek Boží s lidmi, a přebývati bude s nimi. A oni lid jeho budou: a on Bůh s nimi bude jejich Bůh:']",low
1301,Isa 42:6,1,"['„Já, Hospodin, povolal jsem tě k spravedlnosti, vzal jsem tě za ruku a zachoval jsem tebe. A učinil jsem tebe prostředníkem, smlouvy lidu a světlem národům,']",low
1302,1Kgs 8:29,2,"['Oči tvé buďtež otevřeny na dům tento v noci i ve dne, na dům, o kterém jsi řekl: „Bude jméno mé tu"", bys vyslyšel modlitbu, kterou modlí se k tobě služebník tvůj na místě tomto,']",low
1303,Luke 8:12,2,"['A kteříž podlé cesty, jsou ti, kteříž slyší; a potom přichází ďábel, a vynímá slovo z srdce jejich, aby věříce, spaseni nebyli.']",low
1304,John 10:2,1,"['Kdo však vchází dveřmi, jest pastýř ovcí.']",low
1305,John 10:1,1,"['„Vpravdě, vpravdě pravím vám: Kdo nevchází dveřmi do ovčince, nýbrž odjinud vstupuje, ten jest zloděj a lotr.']",low
1306,John 10:7,1,"['Ježíš tedy řekl jim opět: „Vpravdě, vpravdě pravím vám: Já jsem dveře k ovcím.']",low
1307,John 10:6,1,"['Toto podobenství pověděl jim Ježíš, ale oni neporozuměli, co jim mluvil.']",low
1308,John 10:10,1,"['Zloděj přichází jenom krást, zabíjet a hubit; já jsem přišel, aby měly život a aby měly hojnost.“']",low
1309,Phil 1:18,1,"['Co z toho? Jen když každým způsobem, ať pod záminkou (nějakou), ať opravdově zvěstuje se Kristus? A z toho se raduji. Avšak též radovati se budu,']",low
1310,John 17:22,1,"['A já slávu, kterou si mi dal, dal sem jim: aby byli jedno, jakož i my jedno jsme.']",low
1311,Rev 21:23,1,"['A to město nepotřebuje slunce ani měsíce, aby svítili v něm; nebo sláva Boží je osvěcuje, a svíce jeho jest Beránek.']",low
1312,Matt 17:5,1,"['Když ještě mluvil, hle, oblak světlý zastínil je, a hlas z oblaku zazněl řka: „Tento jest Syn můj milý, v němž se mi zalíbilo, toho poslouchejte.“']",low
1313,Rom 8:26,1,"['Podobně však i Duch spolu přispívá slabosti naší. Nevíme totiž, zač bychom měli se modliti, jak jest potřebí; ale Duch sám přimlouvá se za nás za všecky vzdechy nevyslovenými. ']",low
1314,Acts 8:17,2,"['Tehdy vzkládali na ně ruce, a oni přijali Ducha svatého.']",low
1315,1Cor 12:3,1,"['Protož známoť vám činím, že žádný v Duchu Božím mluvě, nezlořečí Ježíši, a žádný nemůže říci Pán Ježíš, jediné v Duchu svatém.']",low
1316,Luke 2:47,1,"['Děsili se pak všickni, kteříž jej slyšeli, nad rozumností a odpověďmi jeho.']",low
1317,Deut 32:52,1,"['Naproti uzříš zemi, kterou já dám synům Israelovým, ale nevejdeš do ní.']",low
1318,1Pet 3:22,1,"['jenž jest na pravici Boží; on (pohltiv smrt, abychom se stali dědici života věčného) přišel do nebe, kde jsou mu poddáni andělé i mocnosti a síly.']",low
1319,Isa 48:21,1,"['Nežíznili na poušti, když je vedl; vodu ze skály vyvedl jim, roztrhl skálu i tekly vody.']",low
1320,John 11:21,1,"['I řekla Marta k Ježíšovi: „Pane, kdybys byl tu byl, bratr můj nebyl by umřel.']",low
1321,John 11:26,2,"['a každý, kdo je živ a věří ve mne, i kdyby zemřel, bude živ; a každý, kdo je živ a věří ve mne, nezemře na věky. Věříš tomu?“', 'a každý, kdo žije a ve mne věří, neumře na věky. Véříš-li tomu?“']",low
1322,Ezek 36:28,1,"['I budete bydliti v zemi, kterouž jsem byl dal otcům vašim, a budete lidem mým, a já budu vaším Bohem.']",low
1323,Deut 18:15,2,"['Proroka z prostředku tvého, z bratří tvých, jako já jsem, vzbudí tobě Hospodin Bůh tvůj; jeho poslouchati budete,']",low
1324,John 19:10,1,['I řekl mu Pilát: „Se mnou nemluvíš? Nevíš-li že mám moc tebe propustiti a mám moc tebe ukřižovati?“'],low
1325,Gal 5:21,3,"['závisti, opilství, nestřídmost a podobné; a to vám předpovídám, jak jsem vám již i předpověděl: lidé, kteří takové věci činí, nebudou mít údělu v království Božím. ', 'závist, vraždy, opilství, obžerství a věci jim podobné; o těch vám předpovídám, jakož jsem byl již předpověděl, že kdo takové věci dělají, království Božího nedojdou.']",low
1326,Ps 144:15,1,"['Oči všech doufají v tebe, Pane, a ty dáváš jim pokrm v čas příhodný,']",low
1327,Isa 25:8,1,"['Sehltí i smrt u vítězství, a setře Panovník Hospodin slzu s všeliké tváři, a pohanění lidu svého odejme ze vší země; (nebo Hospodin mluvil).']",low
1328,Luke 11:11,1,['Kdo pak z vás otce prosí za chléb: zdali kámen dá jemu? Aneb za rybu: zdali místo ryby dá jemu hada?'],low
1329,Mal 1:9,1,"['A nyní uprošujte Boha, aby se smiloval nad vámi, – rukama vašima staň se tak – přijme-li snad na milost vás, praví Hospodin zástupů.']",low
1330,Gen 3:16,2,"['Ženě také řekl: Rozmnožím bídy tvé, a počínání tvá: v bolesti roditi budeš syny, a pod mocí muže budeš, a on panovati bude nad tebou.', 'Ženě pak řekl: Velice rozmnožím bolesti tvé a počínání tvá, s bolestí roditi budeš děti, a pod mocí muže tvého bude žádost tvá, a on panovati bude nad tebou.']",low
1331,Luke 2:35,3,"['tvou vlastní duší pronikne meč -, aby bylo zjeveno smýšlení mnohých srdcí.“']",low
1332,John 14:1,2,"['„Nermutiž se srdce vaše. Věříte v Boha, i ve mne věřte.']",low
1333,Matt 5:23,1,"['Protož obětoval-li bys dar svůj na oltář, a tu bys se rozpomenul, že bratr tvůj má něco proti tobě:']",low
1334,Acts 2:39,1,"['Vždyť vám platí to zaslíbení, i dítkám vašim a všem, kteří jsou v dáli, kolik jich koli povolá Pán Bůh náš.“']",low
1335,Luke 6:36,3,"['Protož buďte milosrdní, jako i Otec váš milosrdný jest.', '„Buďte (tedy) milosrdní, jakož i Otec váš milosrdný jest.']",low
1336,1Pet 3:9,5,"['neodplacujíce zlého za zlé, ani zlořečenství za zlořečenství, ale naproti dobrořečíce: nebo k tomu povoláni ste, abyste požehnáním dědičně vládli.', 'neodplácejte zlo zlem, urážku urážkou, ale naopak žehnejte, neboť k tomu jste byli povoláni, aby se vám dostalo údělem požehnání. ', 'Neodplacujíce zlého za zlé, ani zlořečenství za zlořečenství, ale raději dobrořečíce, vědouce, že jste k tomu povoláni, abyste požehnání dědičně obdrželi.', 'neodplacujte zlým za zlé, ani spíláním za spílání, nýbrž naopak žehnejte, ježto jste povoláni k tomu, abyste požehnání obdrželi dědictvím.']",low
1337,Ps 67:2,2,"['Bože, smiluj se nad námi, a požehnej nám, zasvěť oblíčej svůj nad námi, Sélah,']",low
1338,John 6:55,1,"['Kdo jí mé tělo a pije mou krev, má život věčný, a já ho vzkřísím v den poslední.']",low
1339,Matt 18:10,1,"['„Hleďte, abyste nepohrdali nikým z těchto maličkých: neboť pravím vám, že andělé jejich v nebi stále patří na tvář Otce mého, jenž jest v nebesích.']",low
1340,Ezek 34:10,2,"['Takto praví Panovník Hospodin: Aj, já jsem proti pastýřům těm, a budu vyhledávati stáda mého z ruky jejich, a zastavím jim pasení stáda, aby nepásli více ti pastýři samých sebe. Vytrhnu zajisté ovce své z úst jejich, aby jim nebyly za pokrm.']",low
1341,Luke 1:75,1,"['V svatosti a v spravedlnosti před oblíčejem jeho, po všecky dny života svého.']",low
1342,Prov 31:12,1,"['Dobře činí jemu a ne zle, po všecky dny života svého.']",low
1343,Dan 4:27,1,"['Mluvil král a řekl: Zdaliž toto není ten Babylon veliký, kterýž jsem já vystavěl mocí síly své, aby byl stolicí království k ozdobě slávy mé?']",low
1344,Isa 49:4,1,"['Já pak řekl jsem: Nadarmo jsem pracoval, daremně a marně sílu svou jsem strávil. Ale však soud můj jestiť u Hospodina, a práce má u Boha mého.']",low
1345,Deut 19:7,1,"['Protož já přikazuji tobě, řka: Tři města oddělíš sobě.']",low
1346,1Macc 14:43,1,"['aby pečoval o svatyni, aby ho všichni poslouchali, aby jeho jménem spisovány byly všecky listiny v zemi, aby se obláčel v šarlat a zlato,']",low
1347,1Cor 1:25,3,"['Neboť, co je u Boha pošetilé, je moudřejší než lidé, a co je u Boha slabé, je silnější než lidé.']",low
1348,Gen 12:4,5,"['Tedy vyšel Abram, jakož byl přikázal jemu Pán, a šel s ním Lot: v sedmdesáti pěti letech byl Abram, když vycházel z Háran.']",low
1349,Matt 22:5,1,"['Ale oni zanedbali: a odešli, jiný do dvoru svého, a jiný po kupectví svém:']",low
1350,Ezra 10:12,1,"['Tu odpověděla všecka obec volajíc hlasem velikým: „Podle slova tvého k nám, tak se staň!']",low
1351,Acts 1:9,1,"['A to pověděv, byl vyzdvižen před jejich zraky, a oblak vzal jej s očí jejich.']",low
1352,Luke 1:47,2,"['a duch můj zaplesal v Bohu, Spasiteli mém,']",low
1353,John 9:32,2,"['Od věků není slýcháno, aby kdo otevřel oči slepého narozeného.', 'Od věků nebylo slýcháno, že by byl kdo otevřel oči slepému od narození.']",low
1354,Exod 16:12,1,"['Slyšel jsem reptání synův Israelových; mluv k nim takto: Večer budete jísti maso, ráno pak budete nasyceni chlebem; a zvíte, že jsem já Hospodin, Bůh váš.']",low
1355,Phil 2:16,1,"['Slovo života zachovávajíce, ku poctivosti mé v den Kristův, že jsem ne nadarmo běžel, ani nadarmo pracoval.']",low
1356,Gen 50:23,1,"['Kteréžto věci když se staly, mluvil bratřím svým: Po smrti mé Bůh navštíví vás, a učiní, abyste vstoupili z země této, do země, kterouž přisáhl Abrahamovi, Izákovi, a Jákobovi.']",low
1357,Luke 21:32,1,"['Vpravdě pravím vám: nepomine pokolení toto, až všecko se stane,']",low
1358,Matt 24:34,1,"['Vpravdě pravím vám: nepomine pokolení toto, až toto všecko se stane.']",low
1359,John 20:19,2,"['Když, byl večer toho dne, neděle, a pro strach před židy dveře byly zavřeny (tam), kde byli učeníci (shromážděni), Ježíš přišel a postaviv se mezi ně řekl jim: „Pokoj vám.“', 'Když pak byl večer toho dne, kterýž jest první po sobotě, a dvéře byly zavříny, kdež byli učedlníci shromážděni, pro strach Židovský, přišel Ježíš, a stál u prostřed, a řekl jim: Pokoj vám.']",low
1360,2Pet 3:18,1,['Rozhojňujte se v milosti a v poznání našeho Pána a Spasitele Ježíše Krista. Jemu buď sláva nyní i v den věčnosti!'],low
1361,Exod 20:16/Deut 5:20,2,['Nepromluvíš proti bližnímu svému křivého svědectví.'],low
1362,Luke 2:31,1,['kteréž si připravil před obličejem všech lidí:'],low
1363,Tob 4:7,1,"['Ze svého majetku dávej almužnu a neodvracuj své tváře od žádného chuďasa, neboť pak neodvrátí se též od tebe tvář Hospodinova.']",low
1364,Tob 4:8,1,"['Jak jen budeš moci, buď milosrdný.']",low
1365,Matt 25:45,1,"['Tehdy odpoví jim: ,Vpravdě pravím vám: pokud jste to neučinili jednomu z nejmenších těchto, ani mně jste nečinili.']",low
1366,2Tim 3:12,1,"['A všickni kteříž chtějí pobožně živi býti v Kristu Ježíši, protivenství trpěti budou.']",low
1367,Gen 20:7,1,"['Nyní tedy navrať ženu muži jejímu, nebo prorok jest: a modliti se bude za tebe, a živ budeš: Pakli nebudeš chtíti nevrátiti, věz, že smrtí umřeš ty, i všecko což tvého jest.']",low
1368,Luke 7:8,1,"['Nebo i já jsem člověk pod mocí postavený, maje pod sebou žoldnéře: a dím tomuto: Jdi, a jde; a jinému: Příď, a přijde; a služebníku svému: Učiň toto, a učiní.']",low
1369,Rom 12:19,1,"['nemstěte se sami, miláčkové, nýbrž dejte místo hněvu (Božímu), neboť jest psáno: „Mně (patří) pomsta, já odplatím, praví Hospodin.“ ']",low
1370,Gen 40:14,3,"['Vzpomeň si jen na mne, až se budeš míti dobře, a prokaž mi milost, že se přimluvíš za mne u faraona, aby mě vyvedl z tohoto žaláře;']",low
1371,2Kgs 6:12,1,"['Jeden ze služebníků jeho pravil: „Nikoli, pane můj, králi, ale Eliseus prorok, který je v Israeli, oznamuje králi israelskému všecka slova, která mluvíš v ložnici své!""']",low
1372,2Kgs 6:16,1,"['On však odpověděl: „Neboj se; neboť více jich s námi je nežli s nimi.""']",low
1373,1Pet 2:12,1,"['žijte mezi pohany řádně, aby, ačkoli vás pomlouvají jako pachatele zlých věcí, z vašich dobrých činů, jež budou pozorovati, vzdali Bohu slávu v den, kdy na ně shlédne. ']",low
1374,Judg 5:2,1,"['Pro pomstu učiněnou v Izraeli, a pro lid, kterýž se k tomu dobrovolně měl, dobrořečte Hospodinu.']",low
1375,Ps 135:19,1,"['Dome Izraelský, dobrořečte Hospodinu; dome Aronův, dobrořečte Hospodinu.']",low
1376,Ps 135:20,1,"['Dome Léví, dobrořečte Hospodinu; kteříž se bojíte Hospodina, dobrořečte Hospodinu.']",low
1377,Judg 5:9,1,"['Srdce mé miluje vůdce Israelovy, vás, kteří rádi se vydali v nebezpečí. Dobrořečte Hospodinu!']",low
1378,John 1:52,1,"['I dí mu: Amen, amen pravím vám: Od tohoto času uzříte nebe otevřené, a anděly Boží vstupující a sstupující na Syna člověka.']",low
1379,Ezra 9:14,3,"['abychom se neobrátili, a nerušili přikázaní tvých, ani se manželstvím nespojovali s lidmi ohavností těchto: Zdaliž si se rozhněval na nás až do skonání, abys nenechal nám ostatků k zachování?']",low
1380,Matt 13:55,1,"['Není-liž to syn tesařův? zda nejmenuje se matka jeho Maria a bratři jeho Jakub a Josef a Šimon a Juda? a sestry jeho, nejsou-li všecky u nás?']",low
1381,Matt 12:46,1,"['A když on ještě mluvil k zástupům, aj matka jeho a bratří stáli vně, žádajíce s ním mluviti.']",low
1382,Matt 12:48,1,"['On pak odpovídaje tomu, který mu to byl pověděl, řekl: „Kdo jest matka má, a kdo jsou bratři moji?“']",low
1383,John 19:25,1,['Stály pak u kříže Ježíšova jeho matka a sestra matky jeho Maria Kleofášova a Maria Magdalena.'],low
1384,1John 3:18,1,"['Synáčkové moji, nemilújmež slovem, ani jazykem, ale skutkem a pravdou.']",low
1385,Deut 15:11,1,"['V zemi, v níž budeš sídliti, nebude se nedostávati chudých; proto ti přikazuji, abys otvíral ruku potřebnému bratru svému a chudému, který s tebou v zemi přebývá.']",low
1386,Matt 5:46,1,"['Neboť milujete-li ty, kteří vás milují, jakou odplatu míti budete? Zdali nečiní toho i celníci?']",low
1387,Prov 25:21,1,"['Lační-li tvůj nepřítel, dej mu jísti, a jestli žízní, dej mu vody píti;']",low
1388,John 15:22,1,"['Kdybych byl nepřišel, a nemluvil jim, hříchu by neměli; ale nyní výmluvy nemají z hříchu svého.']",low
1389,Luke 20:18,1,"['Každý, kdož padne na ten kámen, rozrazí se; a na kohož by on upadl, potřeť jej.']",low
1390,Gen 32:27,1,['Řekl tedy: Které jest jméno tvé? Odpověděl: Jákob.'],low
1391,Gen 32:30,1,"['I nazval Jákob jméno místa toho Fanuel, řka: Viděl sem Boha tváří v tvář, a spasena jest učiněna duše má.']",low
1392,John 14:5,1,"['Řekl mu Tomáš: „Pane, nevíme, kam jdeš: i kterak můžeme znáti cestu?“']",low
1393,2Macc 14:26,2,"['Ale Alcim vida jejich vzájemnou lásku a smlouvy přišel k Demetriovi a pravil, že Nikanor svoluje k nepřátelským podnikům a že Judu, úkladníka říše, nástupcem jeho ustanovil.']",low
1394,Acts 2:13,1,['Ale jiní posmívajíce se pravili: „Jsou plni sladkého vína.“'],low
1395,Acts 2:41,1,"['I byli pokřtěni ti, kteří přijali řeč jeho; a připojilo se jich v ten den as tři tisíce duší.']",low
1396,2Pet 1:2,1,"['Milost vám a pokoj naplněn buď v poznání Boha, a Krista Ježíše Pána našeho:']",low
1397,Josh 17:16,1,"['Synové Josefovi mu odpověděli: Na hory nebude nám možno se dostati, ježto Kanaanští, sídlící v rovině, kde je Bet-san se svými vesničkami, a Jezrael, zabírající střed nížiny, užívají železných vozů.']",low
1398,2Cor 3:6,2,"['on nás učinil také dostatečnými jako služebníky nové smlouvy, smlouvy ne litery, ale ducha. Neboť litera zabíjí, ale duch oživuje.']",low
1399,1Sam 2:14,1,"['i strkal ji do kotlíku, do pánve, do hrnce nebo do kotle, a vše, co vidličkou vyzdvihl, brával kněz sobě; tak činívali všem. Israelitům, kteří přicházeli do Sila.']",low
1400,Ezek 20:15,1,"['Já tedy pozdvihl sem ruku svou na ně na poušti, abych jich neuvedl do země, kterouž sem jim dal, tekoucí mlékem a strdí, nejpřednější ze všech zemí:']",low
1401,Zech 4:13,3,"['I řekl mi: „Zda (skutečně) nevíš, co tyto věci jsou?"" Odpověděl jsem: „Ne, pane můj!""']",low
1402,Jer 6:3,5,"['Přijdou na ni pastýři se svými stády, rozbijí na ní stany kolem dokola; spase každý, co mu do rukou přijde.']",low
1403,Num 22:12,1,"['Bůh řekl Balaamovi: Nechoď s nimi a lidu toho neproklínej, neboť jest požehnaný.']",low
1404,Sir 37:21,1,"['Zlé oko měnívá smýšlení; z něho pocházejí čtyři věci: dobro a zlo, život a smrt; a pánem nad nimi ustavičným jest – jazyk. Bývá muž zběhlý, který vzdělává mnohé, ale sám sobě jest neužitečný.']",low
1405,Ezek 31:14,1,"['Proto nesmí se pozdvihovati pro svou výši žádný strom u vody, nesmí hnáti vrch svůj mezi hustým a listnatým větvovím do výše, aniž smí pyšně státi ve své výši cokoliv bývá zavlažováno vodami; neboť všichni jsou odevzdáni smrti pro nejzazší kraj, mezi lidi, mezi ty, kteří padají do jámy.']",low
1406,Ezek 31:11,1,"['Protož vydal jsem jej v ruku nejsilnějšího z národů, aby s ním přísně nakládal; pro bezbožnost jeho vyhnal jsem jej.']",low
1407,Ezek 24:19,11,"['I řekl mně lid: „Proč nám neoznamuješ, co znamenají tyto věci, jež činíš?""']",low
1408,Prov 3:13,1,"['Blaze člověku, který nalezl moudrost, a jenž oplývá opatrností;']",low
1409,Gen 27:28,1,"['Dejž tobě Bůh z rosy Nebeské, a z tučnosti zemské, hojnost obilí a vína.']",low
1410,Matt 12:1,1,"['V ten čas šel Ježíš v sobotu skrze obilí, učedlníci pak jeho lační jsouce, počali vymínati klasy a jísti.']",low
1411,Matt 3:12,1,"['Jehožto věječka v ruce jeho, a vyčistí-ť humno své, a shromáždí pšenici svou do obilnice: ale plevy páliti bude ohněm neuhasitedlným.']",low
1412,Deut 11:9,5,"['a dlouho byli živi v té zemi, oplývající mlékem a medem, kterou přísežně slíbil Hospodin otcům vašim a jejich potomstvu.', 'A aby se prodlili dnové vaši na zemi, kterouž s přísahou zaslíbil dáti Hospodin otcům vašim i semeni jejich, zemi mlékem a strdí oplývající.']",low
1413,Matt 3:4,1,"['Ten pak Jan měl roucho z srstí velbloudových, a pás kožený okolo bedr svých, a pokrm jeho byl kobylky a med lesní.']",low
1414,Rev 10:10,1,"['I vzal sem knihu z ruky Anjela, a požřel sem ji: i bylo v ustech mých sladko jako med: a když sem ji požřel, hořko mi bylo v břiše mém.']",low
1415,Matt 26:7,1,"['Přistoupila k němu žena, mající nádobu alabastrovou masti velmi drahé, i vylila ji na hlavu jeho, když seděl za stolem.']",low
1416,Luke 7:46,1,['Olejem hlavy mé nepomazal si: ale tato mastí mazala nohy mé.'],low
1417,Luke 12:18,2,"['I řekl: Toto učiním: Zbořím stodoly své, a větších nastavím, a tu shromáždím všecky své úrody i zboží svá.', 'A řekl: ,Tohle učiním: Zbořím své stodoly a vystavím větší, a tam složím úrodu svou i všecko zboží své']",low
