,size,Group,Verse text
John 15:25,1,3-5,"Ale (to se dělo a děje), aby se naplnilo slovo, které jest napsáno v zákoně jejich: ,Nenáviděli mě bez příčiny‘."
Ps 37:5,1,6-10,"Uval na Hospodina cestu svou, a slož v něm naději, onť zajisté všecko spraví."
Gal 6:2,1,6-10,"Jedni druhých břemena neste, a tak plňte zákon Kristův."
Phil 4:15,1,3-5,"Víte pak i vy, Filippští, že při počátku evangelia, když jsem vyšel z Macedonie, žádná církev se nezúčastnila se mnou v účtech příjmů a vydání, leč vy jediní;"
John 19:36,1,3-5,"Staloť se to zajisté, aby se naplnilo Písmo: Kosti mu nezlomíte."
Matt 26:31,1,3-5,"Tedy dí jim Ježíš: Všickni vy zhoršíte se nade mnou této noci. Nebo psáno jest: Bíti budu pastýře, a rozprchnouť se ovce stáda."
Gen 1:28,1,3-5,"A požehnal jim Bůh, a řekl jim Bůh: Ploďtež se a rozmnožujte se, a naplňte zemi, a podmaňte ji, a panujte nad rybami mořskými, a nad ptactvem nebeským, i nad všelikým živočichem hýbajícím se na zemi."
Luke 12:20,1,3-5,"Řekl pak jemu Bůh: Blázne, této noci požádají duše tvé od tebe, to pak cožs připravil, čí bude?"
Ps 31:6,1,3-5,"V ruce tvé poroučím ducha svého, nebo jsi mne vykoupil, Hospodine, Bože silný a věrný."
Ps 138:8,1,3-5,"Hospodin dokoná za mne; nebo milosrdenství tvé, Hospodine, na věky, aniž díla rukou svých kdy opustíš."
Matt 20:34,1,3-5,"Ježíš se nad nimi slitoval, dotkl se jejich zraků, a hned nabyli zraku a následovali ho."
Luke 11:10,1,3-5,"neboť každý, kdo prosí, béře; a kdo hledá, nalézá, a tomu, kdo tluče, bude otevřeno."
2Cor 11:26,1,3-5,"Na cestách často, v nebezpečenství na řekách, v nebezpečenství od lotrů, v nebezpečenství od svého pokolení, v nebezpečenství od pohanů, v nebezpečenství v městě, v nebezpečenství na poušti, v nebezpečenství na moři, v nebezpečenství mezi falešnými bratřími."
Lam 5:16,1,3-5,"Spadla koruna s hlavy naší; běda nám již, že jsme hřešili."
John 16:17,1,3-5,"I řekli někteří z učeníků jeho k sobě vespolek: „Co jest to, co nám praví: ,Maličko, a neuzříte mne, a opět maličko, a uzříte mě‘ a ,poněvadž jdu k Otci?‘“"
Mark 6:16,1,3-5,"Když o tom uslyšel Heródes, řekl: „Jan, kterého jsem sťal, vstal z mrtvých.“"
Ps 113:3,1,3-5,Od východu slunce až do západu jeho chváleno buď jméno Hospodinovo.
Wis 19:4,1,3-5,"Pudil je totiž k tomu konci zasloužený tlak; způsobil, že zapomněli na to, co se bylo přihodilo, aby doplnili trest, kterého se nedostávalo ranám jejich,"
Zech 4:6,1,3-5,"Tedy odpovídaje, mluvil ke mně, řka: Toto jest slovo Hospodinovo k Zorobábelovi, řkoucí: Ne silou, ani mocí, ale Duchem mým, praví Hospodin zástupů."
Dan 12:3,1,3-5,"Ale ti, kteříž jiné vyučují, stkvíti se budou jako blesk oblohy, a kteříž k spravedlnosti přivozují mnohé, jako hvězdy na věčné věky."
Matt 26:21,1,3-5,"Když jedli, řekl: „Vpravdě vám pravím, že jeden z vás mě zradí.“"
Acts 21:6,1,3-5,"A když jsme se vespolek rozžehnali, vstoupli jsme na lodí, a oni se vrátili domů."
Jer 6:16,1,3-5,"Když takto říkával Hospodin: Zastavte se na cestách, a pohleďte, a vyptejte se na stezky staré, která jest cesta dobrá, i choďte po ní, a naleznete odpočinutí duši své, tedy říkávali: Nebudeme choditi."
1Tim 5:20,1,3-5,"Ty, kteří hřeší, kárej přede všemi, aby se i ostatní báli."
John 16:12,1,3-5,"„Mám vám ještě mnoho co říci, ale vy byste to nyní nesnesli. "
Rev 2:10,1,3-5,"Nebojž se nic toho, co trpěti máš. Aj, uvržeť ďábel některé z vás do vězení, abyste zkušeni byli, a budete míti úzkost za deset dní. Budiž věrný až do smrti, a dámť korunu života."
Luke 21:27,1,3-5,"A tehdy uvidí Syna člověka, an přichází v oblace s velikou moci a slávou."
Moravský hospodář,5,Periodikum: Moravský hospodář,Moravský hospodář
Polední list,5,Periodikum: Polední list,Polední list
Moravský večerník,5,Periodikum: Moravský večerník,Moravský večerník
Věstník katolického duchovenstva,5,Periodikum: Věstník katolického duchovenstva,Věstník katolického duchovenstva
Přítomnost,5,Periodikum: Přítomnost,Přítomnost
Venkov,5,Periodikum: Venkov,Venkov
Studentský časopis,5,Periodikum: Studentský časopis,Studentský časopis
Československý zemědělec,5,Periodikum: Československý zemědělec,Československý zemědělec
Český učitel,5,Periodikum: Český učitel,Český učitel
Čech,5,Periodikum: Čech,Čech
Posel záhrobní,5,Periodikum: Posel záhrobní,Posel záhrobní
